{
  "$schema": "https://json-schema.org/draft/2020-12/schema",
  "$id": "https://woowa-learning-hub/r3-qrels-schema",
  "title": "R3 Real Qrel Suite Schema",
  "description": "Schema for the R3 Real qrel suite. Companion to docs/worklogs/rag-r3-system-spec-v1.md §8 and docs/worklogs/rag-r3-corpus-v3-contract.md. Defines 6 evaluation cohorts (paraphrase_human, confusable_pairs, symptom_to_cause, mission_bridge, corpus_gap_probe, forbidden_neighbor). Seed qrels can be auto-generated from corpus v3 frontmatter expected_queries; production qrels are human-curated to break the alias-indexing circular validation that affected the 208q legacy gate.",
  "type": "object",
  "additionalProperties": false,
  "required": ["schema_version", "queries"],
  "properties": {
    "schema_version": {
      "type": "integer",
      "const": 1,
      "description": "Schema version. Reserved 1 for v3 system Real qrel suite."
    },
    "fixture_id": {
      "type": "string",
      "minLength": 1,
      "description": "Identifier for this fixture (e.g. 'r3_real_v1', 'r3_real_v0_seed'). Used in trace artifacts to attribute measurements."
    },
    "generated_at": {
      "type": "string",
      "format": "date-time",
      "description": "ISO-8601 timestamp when this fixture was authored or last updated."
    },
    "authoring_method": {
      "type": "string",
      "enum": [
        "human_only",
        "ai_first_human_review",
        "ai_first_ai_review",
        "auto_from_expected_queries"
      ],
      "description": "How qrels were authored. 'auto_from_expected_queries' is allowed only for seed/scaffolding; cohorts paraphrase_human / corpus_gap_probe / forbidden_neighbor MUST NOT use this method."
    },
    "cohort_distribution_target": {
      "type": "object",
      "additionalProperties": false,
      "description": "Optional declaration of how many queries each cohort should have. Validation tooling checks the actual queries match these counts.",
      "properties": {
        "paraphrase_human": { "type": "integer", "minimum": 0 },
        "confusable_pairs": { "type": "integer", "minimum": 0 },
        "symptom_to_cause": { "type": "integer", "minimum": 0 },
        "mission_bridge": { "type": "integer", "minimum": 0 },
        "corpus_gap_probe": { "type": "integer", "minimum": 0 },
        "forbidden_neighbor": { "type": "integer", "minimum": 0 }
      }
    },
    "queries": {
      "type": "array",
      "minItems": 1,
      "items": { "$ref": "#/$defs/query" }
    }
  },
  "$defs": {
    "query": {
      "type": "object",
      "additionalProperties": false,
      "required": [
        "query_id",
        "prompt",
        "language",
        "level",
        "cohort_tag",
        "primary_paths",
        "expected_concepts"
      ],
      "properties": {
        "query_id": {
          "type": "string",
          "pattern": "^[a-z0-9_:.\\-/]+$",
          "minLength": 3,
          "description": "Unique within the fixture. Suggested format: '<cohort>:<concept_or_topic>:<index>' (kebab-case + colons)."
        },
        "prompt": {
          "type": "string",
          "minLength": 1,
          "description": "The query as a learner would type it. Korean queries written in Korean. Mixed queries kept as-typed."
        },
        "language": {
          "type": "string",
          "enum": ["ko", "en", "mixed"]
        },
        "intent": {
          "type": "string",
          "enum": [
            "definition",
            "comparison",
            "symptom",
            "mission_bridge",
            "deep_dive",
            "drill"
          ],
          "description": "Optional. Phase 1 spec §3.5 enumerates intent labels."
        },
        "level": {
          "type": "string",
          "enum": ["beginner", "intermediate", "advanced"],
          "description": "Learner level the query represents."
        },
        "cohort_tag": {
          "type": "string",
          "enum": [
            "paraphrase_human",
            "confusable_pairs",
            "symptom_to_cause",
            "mission_bridge",
            "corpus_gap_probe",
            "forbidden_neighbor"
          ]
        },
        "primary_paths": {
          "type": "array",
          "items": {
            "type": "string",
            "pattern": "^contents\\/[a-z][a-z0-9-]*\\/[a-z0-9_.\\-/]+\\.md$"
          },
          "uniqueItems": true,
          "description": "List of primary correct doc paths. corpus_gap_probe MAY have empty primary_paths (the system should respond 'not in corpus'). All other cohorts must have at least 1."
        },
        "acceptable_paths": {
          "type": "array",
          "items": {
            "type": "string",
            "pattern": "^contents\\/[a-z][a-z0-9-]*\\/[a-z0-9_.\\-/]+\\.md$"
          },
          "uniqueItems": true,
          "description": "Docs that are acceptable answers but not the primary. Disjoint from primary_paths and forbidden_paths (enforced by validator)."
        },
        "forbidden_paths": {
          "type": "array",
          "items": {
            "type": "string",
            "pattern": "^contents\\/[a-z][a-z0-9-]*\\/[a-z0-9_.\\-/]+\\.md$"
          },
          "uniqueItems": true,
          "description": "Docs that must NOT appear in top-K. Required ≥ 1 for forbidden_neighbor cohort. Disjoint from primary_paths and acceptable_paths."
        },
        "expected_concepts": {
          "type": "array",
          "items": {
            "type": "string",
            "pattern": "^[a-z][a-z0-9-]*\\/[a-z][a-z0-9-]+$"
          },
          "uniqueItems": true,
          "minItems": 1,
          "description": "concept_id refs that should be invoked by query understanding. Cross-checked against corpus catalog v3."
        },
        "failure_focus": {
          "type": "array",
          "items": {
            "type": "string",
            "pattern": "^[a-z][a-z0-9_-]*$"
          },
          "uniqueItems": true,
          "description": "Free-form keyword tags describing what kind of failure this query stresses. Examples: 'paraphrase_robustness', 'beginner_primer', 'korean_alias', 'mission_term', 'confusable_routing'. Used by failure taxonomy classifier post-measurement."
        },
        "mission_id": {
          "type": "string",
          "pattern": "^missions\\/[a-z][a-z0-9-]+$",
          "description": "Optional. Required for cohort=mission_bridge. Specifies which Woowa mission context the query is bound to."
        },
        "prior_turn": {
          "type": "object",
          "additionalProperties": false,
          "description": "Optional multi-turn context. When set, simulates a follow-up query where prior_turn.primary_concept is the prior turn's resolved concept_id.",
          "properties": {
            "prior_query_id": { "type": "string" },
            "primary_concept": {
              "type": "string",
              "pattern": "^[a-z][a-z0-9-]*\\/[a-z][a-z0-9-]+$"
            }
          },
          "required": ["primary_concept"]
        },
        "rationale": {
          "type": "string",
          "description": "Optional human-readable explanation: why is this the primary doc? what makes the query hard? Used for review."
        }
      },
      "allOf": [
        {
          "if": {
            "properties": { "cohort_tag": { "const": "mission_bridge" } },
            "required": ["cohort_tag"]
          },
          "then": {
            "required": ["mission_id"]
          }
        },
        {
          "if": {
            "properties": { "cohort_tag": { "const": "corpus_gap_probe" } },
            "required": ["cohort_tag"]
          },
          "then": {
            "properties": {
              "primary_paths": { "maxItems": 0 }
            }
          }
        },
        {
          "if": {
            "not": {
              "properties": { "cohort_tag": { "const": "corpus_gap_probe" } }
            }
          },
          "then": {
            "properties": {
              "primary_paths": { "minItems": 1 }
            }
          }
        },
        {
          "if": {
            "properties": { "cohort_tag": { "const": "forbidden_neighbor" } },
            "required": ["cohort_tag"]
          },
          "then": {
            "required": ["forbidden_paths"],
            "properties": {
              "forbidden_paths": { "minItems": 1 }
            }
          }
        }
      ]
    }
  }
}
