{
  "authoring_method": "ai_first_ai_review",
  "cohort_distribution_target": {
    "confusable_pairs": 40,
    "corpus_gap_probe": 20,
    "forbidden_neighbor": 30,
    "mission_bridge": 30,
    "paraphrase_human": 50,
    "symptom_to_cause": 30
  },
  "fixture_id": "r3_qrels_real_v1",
  "generated_at": "2026-05-02T16:12:35.066813+00:00",
  "queries": [
    {
      "acceptable_paths": [
        "contents/spring/ioc-di-container.md"
      ],
      "cohort_tag": "paraphrase_human",
      "expected_concepts": [
        "spring/bean-di-basics"
      ],
      "failure_focus": [
        "paraphrase_robustness",
        "korean_no_alias_match"
      ],
      "intent": "definition",
      "language": "ko",
      "level": "beginner",
      "primary_paths": [
        "contents/spring/spring-bean-di-basics.md"
      ],
      "prompt": "객체를 직접 만들지 않고 외부에서 받는 게 뭐야?",
      "query_id": "paraphrase_human:spring_di:001",
      "rationale": "학습자가 'DI', '의존성 주입' 단어를 모르고 *원리*만 paraphrase. alias 매칭으로 풀리면 안 됨."
    },
    {
      "acceptable_paths": [
        "contents/spring/ioc-di-container.md",
        "contents/spring/spring-bean-di-basics.md"
      ],
      "cohort_tag": "paraphrase_human",
      "expected_concepts": [
        "spring/bean-lifecycle-basics"
      ],
      "failure_focus": [
        "paraphrase_robustness",
        "beginner_primer"
      ],
      "intent": "definition",
      "language": "ko",
      "level": "beginner",
      "primary_paths": [
        "contents/spring/spring-bean-lifecycle-basics.md"
      ],
      "prompt": "스프링이 객체를 어떻게 만들어주는지 큰 그림이 궁금해",
      "query_id": "paraphrase_human:spring_bean:001"
    },
    {
      "cohort_tag": "paraphrase_human",
      "expected_concepts": [
        "database/connection-pool"
      ],
      "failure_focus": [
        "paraphrase_robustness",
        "concept_explanation"
      ],
      "intent": "definition",
      "language": "ko",
      "level": "beginner",
      "primary_paths": [
        "contents/database/connection-pool-basics.md"
      ],
      "prompt": "DB 연결을 미리 만들어두고 빌려쓴다는 게 무슨 의미야?",
      "query_id": "paraphrase_human:database_connection_pool:001"
    },
    {
      "acceptable_paths": [
        "contents/database/transaction-isolation-basics.md"
      ],
      "cohort_tag": "paraphrase_human",
      "expected_concepts": [
        "database/lock-basics"
      ],
      "failure_focus": [
        "paraphrase_robustness",
        "concurrency_concept"
      ],
      "intent": "definition",
      "language": "ko",
      "level": "beginner",
      "primary_paths": [
        "contents/database/lock-basics.md"
      ],
      "prompt": "여러 사람이 같은 데이터 동시에 바꾸려 할 때 충돌 어떻게 막아?",
      "query_id": "paraphrase_human:database_lock:001"
    },
    {
      "cohort_tag": "paraphrase_human",
      "expected_concepts": [
        "database/transaction-isolation-basics"
      ],
      "failure_focus": [
        "paraphrase_robustness",
        "intermediate_concept"
      ],
      "intent": "definition",
      "language": "ko",
      "level": "intermediate",
      "primary_paths": [
        "contents/database/transaction-isolation-basics.md"
      ],
      "prompt": "트랜잭션이 서로 어디까지 보고 어디까지 못 보게 할지 단계가 있다며",
      "query_id": "paraphrase_human:database_isolation:001"
    },
    {
      "cohort_tag": "paraphrase_human",
      "expected_concepts": [
        "design-pattern/factory"
      ],
      "failure_focus": [
        "paraphrase_robustness",
        "no_alias_factory"
      ],
      "intent": "definition",
      "language": "ko",
      "level": "beginner",
      "primary_paths": [
        "contents/design-pattern/factory-basics.md"
      ],
      "prompt": "객체 생성 책임을 다른 클래스로 옮기는 방식 뭐 있어?",
      "query_id": "paraphrase_human:design_pattern_factory:001"
    },
    {
      "acceptable_paths": [
        "contents/software-engineering/repository-dao-entity.md"
      ],
      "cohort_tag": "paraphrase_human",
      "expected_concepts": [
        "software-engineering/repository-interface-contract-primer"
      ],
      "failure_focus": [
        "paraphrase_robustness",
        "ddd_concept"
      ],
      "intent": "definition",
      "language": "ko",
      "level": "intermediate",
      "primary_paths": [
        "contents/software-engineering/repository-interface-contract-primer.md"
      ],
      "prompt": "도메인 객체 영속성 처리를 인터페이스로 추상화하는 패턴이 뭐야?",
      "query_id": "paraphrase_human:repository_pattern:001"
    },
    {
      "cohort_tag": "paraphrase_human",
      "expected_concepts": [
        "network/latency-bandwidth-throughput-basics"
      ],
      "failure_focus": [
        "paraphrase_robustness",
        "performance_concept"
      ],
      "intent": "definition",
      "language": "ko",
      "level": "beginner",
      "primary_paths": [
        "contents/network/latency-bandwidth-throughput-basics.md"
      ],
      "prompt": "네트워크에서 응답이 느린 이유 어떤 종류로 나눠서 봐야 해?",
      "query_id": "paraphrase_human:network_latency:001"
    },
    {
      "acceptable_paths": [
        "contents/spring/ioc-di-container.md",
        "contents/design-pattern/injected-registry-vs-service-locator-checklist.md"
      ],
      "cohort_tag": "confusable_pairs",
      "expected_concepts": [
        "spring/bean-di-basics"
      ],
      "failure_focus": [
        "confusable_routing",
        "di_vs_locator_disambiguation"
      ],
      "forbidden_paths": [],
      "intent": "comparison",
      "language": "ko",
      "level": "intermediate",
      "primary_paths": [
        "contents/spring/spring-bean-di-basics.md"
      ],
      "prompt": "스프링에서 컨테이너에서 직접 꺼내 쓰면 안 되는 이유 알려줘",
      "query_id": "confusable_pairs:di_vs_service_locator:001",
      "rationale": "DI vs Service Locator 짝 — DI 쪽이 primary, locator 비교 doc는 acceptable. locator 자체의 antipattern doc은 forbidden 케이스에서 정의."
    },
    {
      "acceptable_paths": [
        "contents/design-pattern/factory-basics.md",
        "contents/spring/ioc-di-container.md"
      ],
      "cohort_tag": "confusable_pairs",
      "expected_concepts": [
        "design-pattern/factory",
        "design-pattern/factory-vs-di-container-wiring"
      ],
      "failure_focus": [
        "confusable_routing",
        "factory_di_disambiguation"
      ],
      "intent": "comparison",
      "language": "ko",
      "level": "intermediate",
      "primary_paths": [
        "contents/design-pattern/factory-vs-di-container-wiring.md"
      ],
      "prompt": "팩토리 메서드랑 스프링 DI 컨테이너가 같은 거야 다른 거야?",
      "query_id": "confusable_pairs:factory_vs_di_container:001"
    },
    {
      "acceptable_paths": [
        "contents/design-pattern/factory-basics.md"
      ],
      "cohort_tag": "confusable_pairs",
      "expected_concepts": [
        "design-pattern/bridge-strategy-vs-factory-runtime-selection",
        "design-pattern/factory"
      ],
      "failure_focus": [
        "confusable_routing",
        "strategy_factory_disambiguation"
      ],
      "intent": "comparison",
      "language": "ko",
      "level": "intermediate",
      "primary_paths": [
        "contents/design-pattern/bridge-strategy-vs-factory-runtime-selection.md"
      ],
      "prompt": "런타임에 알고리즘 갈아끼우는 게 strategy야 factory야?",
      "query_id": "confusable_pairs:strategy_vs_factory:001"
    },
    {
      "acceptable_paths": [
        "contents/database/lock-basics.md",
        "contents/database/transaction-isolation-basics.md"
      ],
      "cohort_tag": "confusable_pairs",
      "expected_concepts": [
        "database/mvcc-snapshot-vs-locking-read-portability"
      ],
      "failure_focus": [
        "confusable_routing",
        "mvcc_lock_disambiguation"
      ],
      "intent": "comparison",
      "language": "ko",
      "level": "intermediate",
      "primary_paths": [
        "contents/database/mvcc-snapshot-vs-locking-read-portability-note.md"
      ],
      "prompt": "스냅샷으로 읽는 거랑 락 걸어서 읽는 거 차이가 뭐야?",
      "query_id": "confusable_pairs:mvcc_vs_lock:001"
    },
    {
      "acceptable_paths": [
        "contents/database/lock-basics.md"
      ],
      "cohort_tag": "confusable_pairs",
      "expected_concepts": [
        "database/deadlock-vs-lock-wait-timeout-primer"
      ],
      "failure_focus": [
        "confusable_routing",
        "deadlock_timeout_disambiguation"
      ],
      "intent": "comparison",
      "language": "ko",
      "level": "intermediate",
      "primary_paths": [
        "contents/database/deadlock-vs-lock-wait-timeout-primer.md"
      ],
      "prompt": "데드락이랑 락 대기 시간 초과 어떻게 구분해?",
      "query_id": "confusable_pairs:deadlock_vs_lock_timeout:001"
    },
    {
      "acceptable_paths": [
        "contents/software-engineering/repository-interface-contract-primer.md",
        "contents/software-engineering/repository-naming-smells-primer.md"
      ],
      "cohort_tag": "confusable_pairs",
      "expected_concepts": [
        "software-engineering/repository-dao-entity"
      ],
      "failure_focus": [
        "confusable_routing",
        "repository_dao_disambiguation"
      ],
      "intent": "comparison",
      "language": "ko",
      "level": "intermediate",
      "primary_paths": [
        "contents/software-engineering/repository-dao-entity.md"
      ],
      "prompt": "리포지토리랑 DAO가 같은 거야 다른 거야?",
      "query_id": "confusable_pairs:repository_vs_dao:001"
    },
    {
      "acceptable_paths": [
        "contents/spring/spring-bean-di-basics.md"
      ],
      "cohort_tag": "confusable_pairs",
      "expected_concepts": [
        "design-pattern/injected-registry-vs-service-locator-checklist"
      ],
      "failure_focus": [
        "confusable_routing",
        "registry_locator_disambiguation"
      ],
      "intent": "comparison",
      "language": "ko",
      "level": "advanced",
      "primary_paths": [
        "contents/design-pattern/injected-registry-vs-service-locator-checklist.md"
      ],
      "prompt": "주입받은 registry랑 service locator는 뭐가 달라?",
      "query_id": "confusable_pairs:registry_vs_service_locator:001"
    },
    {